{
  "schemaVersion": "r4_public_core_local_postgres_docker_diagnostic_rescue_correction_evidence.v1",
  "status": "LOCAL_POSTGRES_DOCKER_DIAGNOSTIC_RESCUE_CORRECTION_IMPLEMENTATION_EVIDENCE_GREEN_STATUS_FREEZE_REQUIRED_PHYSICAL_EXECUTION_NOT_REQUESTED_GATE_C_NOT_REQUESTED",
  "generatedAt": "2026-08-14T07:56:25Z",
  "authority": {
    "correctionAddendumSha256": "sha256:b85d2cd57322e050996e3ec943334e187c2ab29e9f68aff49e4cab66e297c8c9",
    "correctionOwnerReviewSha256": "sha256:1951a47f27bfb671e105a174f8a2dac3fe174a8bbf0ea36ed88620595939aed4",
    "correctionAddendumHead": "56553e4a1e7bc65516f1f14cbac7e8fab2a53262",
    "correctionAddendumTree": "45a8b295d5308766e2bf0a6f4715af0d5c5edaef",
    "correctionOwnerReviewHead": "eb38eff55c2360b51df13dceb896680ec4440479",
    "correctionOwnerReviewTree": "96abe090ac364a973d1b9bc6edc3e5ea70af4d6e",
    "ownerApproval": "APPROVED_EXACT_NINE_CHOICES",
    "repositoryCorrectionGrant": "CONSUMED_BY_KD_LD_MD_ONLY",
    "cleanupRescueGrant": "NOT_REQUESTED",
    "freshPhysicalExecutionGrant": "NOT_REQUESTED",
    "gateCGrant": "NOT_REQUESTED"
  },
  "lineage": {
    "failedExecutionReview": {
      "head": "6e67c1f1867d73f27674a5f056e0692c5b42d6a3",
      "tree": "60b3d7b124968a20f6ec30700d389849dd277ab2",
      "parentHead": "7a533f4b2cc91070e7bd78cb6c70c1f28524ec38",
      "exactDelta": "1_PATH_1A"
    },
    "correctionAddendum": {
      "head": "56553e4a1e7bc65516f1f14cbac7e8fab2a53262",
      "tree": "45a8b295d5308766e2bf0a6f4715af0d5c5edaef",
      "parentHead": "6e67c1f1867d73f27674a5f056e0692c5b42d6a3",
      "exactDelta": "1_PATH_1A",
      "artifactSha256": "sha256:b85d2cd57322e050996e3ec943334e187c2ab29e9f68aff49e4cab66e297c8c9"
    },
    "correctionOwnerReview": {
      "head": "eb38eff55c2360b51df13dceb896680ec4440479",
      "tree": "96abe090ac364a973d1b9bc6edc3e5ea70af4d6e",
      "parentHead": "56553e4a1e7bc65516f1f14cbac7e8fab2a53262",
      "exactDelta": "1_PATH_1A",
      "artifactSha256": "sha256:1951a47f27bfb671e105a174f8a2dac3fe174a8bbf0ea36ed88620595939aed4"
    },
    "implementation": {
      "head": "0fdf68c7c786085189c3df0787df07f366c6df5b",
      "tree": "5f091925b8b48cbd515700b275465506a391ccde",
      "parentHead": "eb38eff55c2360b51df13dceb896680ec4440479",
      "parentTree": "96abe090ac364a973d1b9bc6edc3e5ea70af4d6e",
      "exactDelta": "2_PATHS_0A_2M_0D_0R",
      "artifactAggregateSha256": "sha256:25dba2e75ca042e8c20e096ddaf9f5ee24506fab678a0a0f33366edd8ecebe22"
    }
  },
  "failedPhysicalBaseline": {
    "cardV2Sha256": "sha256:1ca420578f3e16c75b8242d71b93ea7be18baa1815c0f83e610807f9ded7c795",
    "reviewV2Sha256": "sha256:e92a125cdf1f8c4df8448836275bd98225ec8ce0b764dd70dfbabc479366e377",
    "canonicalAuthorityPayloadSha256": "sha256:773a172f0d756b218de9ecfd7e9c2858a28b6ceb236474d103a4822a4203bf56",
    "privateRoot": "/private/tmp/forme-r4-pg-9ZGIOLeX",
    "rootDev": "16777231",
    "rootIno": "32871902",
    "rootMode": "0700",
    "rootUid": "501",
    "rootEntries": [
      "grant.consumed.json",
      "journal-v3",
      "owner-approval-receipt",
      "physical-evidence.json"
    ],
    "ownerApprovalReceiptSha256": "sha256:d16d5482bc5f53ed109d5125fc2747afd786dd51bb35db27a245597811aef10c",
    "ownerApprovalReceiptBytes": 1083,
    "consumedGrantSha256": "sha256:a4f782b8da35b8a2afe7d881b87949326e50f81b0493e2e7ea3dfc70dfc5ba35",
    "consumedGrantBytes": 6356,
    "grantId": "b92ae04555cc3d69a16c06ae53b30976",
    "firstEvidenceSha256": "sha256:3cc212108bf966903fe964a1a73ad468dd506a2c2d473a9e1e916c558cfe02a7",
    "finalEvidenceSha256": "sha256:b3de0db43bf85ead32019266c73d9e9c397f8c7c576f2e5284b8496e980f985c",
    "finalEvidenceBytes": 7180,
    "journalEntryCount": 34,
    "journalHeadSha256": "sha256:2efe5233f94b9f57f17c08aaa792adb2c2353ee75f03ee326b16dcdcd4f10a25",
    "status": "FAILED",
    "code": "local_postgres_cleanup_unproven",
    "cleanupStatus": "BLOCKED",
    "targetPostgresObserved": false,
    "targetCatalogObserved": false
  },
  "workset": {
    "implementationPathCount": 2,
    "evidencePathCount": 3,
    "statusPathCount": 10,
    "totalPathCount": 15,
    "addedPathCount": 4,
    "modifiedPathCount": 11,
    "totalCommitCount": 3,
    "implementationPaths": [
      "scripts/r4-public-core-local-postgres.mjs",
      "test/r4/public-core-local-postgres.test.ts"
    ],
    "evidencePaths": [
      "docs/evidence/r4-public-core-local-postgres-docker-diagnostic-rescue-correction.json",
      "schemas/r4/public-core/local-postgres-docker-diagnostic-rescue-correction-artifact-index.json",
      "schemas/r4/public-core/local-postgres-docker-diagnostic-rescue-correction-evidence.schema.json"
    ],
    "statusPaths": [
      "README.md",
      "docs/CONTROL.md",
      "docs/DECISIONS.md",
      "docs/NATIVE-HARNESS-ARCHITECTURE.md",
      "docs/PRODUCT.md",
      "docs/R4-PUBLIC-CORE-GATE-C-ACTIVATION-CARD.md",
      "docs/R4-PUBLIC-CORE-LOCAL-POSTGRES-DOCKER-DIAGNOSTIC-RESCUE-CORRECTION-CONSTRUCTION-REPORT.md",
      "docs/README.md",
      "docs/ROADMAP.md",
      "docs/VALIDATION.md"
    ]
  },
  "correctionContract": {
    "historicalFailedAuthorityPreserved": true,
    "acceptedContainerMissingDiagnostic": "Error: No such object: <exact-container-name>",
    "diagnosticMatchingIsFullLineExactNameOnly": true,
    "futureRescueCardPath": "docs/R4-PUBLIC-CORE-LOCAL-POSTGRES-BLOCKED-CLEANUP-RESCUE-CARD.md",
    "futureRescueReviewPath": "docs/R4-PUBLIC-CORE-LOCAL-POSTGRES-BLOCKED-CLEANUP-RESCUE-OWNER-REVIEW.md",
    "futureCardAndReviewAreAddOnly": true,
    "cleanupRescueAuthorityVersion": "r4.public-core-local-postgres-cleanup-rescue-authority.v1",
    "cleanupRescueGrantVersion": "r4.public-core-local-postgres-cleanup-rescue-grant.v1",
    "cleanupRescueReceiptVersion": "r4.public-core-local-postgres-cleanup-rescue-receipt.v1",
    "rescueMaximumLifecycleCount": 1,
    "rescueDockerCallCeilings": {
      "version": 1,
      "image.inspect": 0,
      "image.pull": 0,
      "container.inspect": 2,
      "container.create": 0,
      "container.start": 0,
      "container.stop": 1,
      "container.rm": 1,
      "network.inspect": 2,
      "network.create": 0,
      "network.rm": 1,
      "volume.inspect": 2,
      "volume.create": 0,
      "volume.rm": 1
    },
    "oneUseNoRetryWriteAheadConstructed": true,
    "crashRecoveryReplaysDockerCalls": false,
    "crashRecoveryPublishesBlockedEvidence": true,
    "foreignMalformedAmbiguousOrDriftMutatesResources": false,
    "oldForensicRootMutationAllowed": false,
    "imageCreateStartPortCredentialPgSqlProductEffectsAllowed": false,
    "committedCorrectionTopologyVerified": true,
    "zeroRealPortTestsPassed": true
  },
  "validation": {
    "testLanes": [
      {
        "laneId": "local_postgres_runner_fake_deny_network",
        "command": "node --import ./scripts/deny-external-network.mjs --test test/r4/public-core-local-postgres.test.ts",
        "total": 151,
        "passed": 151,
        "failed": 0
      },
      {
        "laneId": "focused_public_core_non_runner_deny_network",
        "command": "node --import ./scripts/deny-external-network.mjs --test test/r4/public-core-application.test.ts test/r4/public-core-privacy.test.ts test/r4/public-core-postgres.test.ts test/r4/public-core-pg-executor.test.ts test/r4/public-core-postgres-application-store.test.ts",
        "total": 85,
        "passed": 85,
        "failed": 0
      },
      {
        "laneId": "public_core_deny_network",
        "command": "node --import ./scripts/deny-external-network.mjs --test test/r4/public-core-*.test.ts",
        "total": 403,
        "passed": 403,
        "failed": 0
      },
      {
        "laneId": "r4_offline_regression",
        "command": "npm run test:r4:offline",
        "total": 723,
        "passed": 723,
        "failed": 0
      },
      {
        "laneId": "gate_b_core_successor_candidate_regression",
        "command": "npm run test:r4:gate-b-core",
        "total": 145,
        "passed": 145,
        "failed": 0
      },
      {
        "laneId": "spine_regression",
        "command": "node --import ./scripts/deny-external-network.mjs --test test/*.test.ts",
        "total": 45,
        "passed": 45,
        "failed": 0
      }
    ],
    "checkLanes": [
      "node --check scripts/r4-public-core-local-postgres.mjs",
      "npm run typecheck",
      "npm --workspace @forme/room run check:no-ai",
      "npm run r4:docs:audit",
      "git diff HEAD^ HEAD --check"
    ],
    "committedBytesOnly": true,
    "allPassed": true
  },
  "effectAudit": {
    "constructionPaths": 15,
    "constructionCommits": 3,
    "dependencyChanges": 0,
    "lockChanges": 0,
    "sqlChanges": 0,
    "externalNetworkCalls": 0,
    "oldForensicRootMutations": 0,
    "pendingRescueGrants": 0,
    "consumedRescueGrants": 0,
    "dockerCliCalls": 0,
    "dockerDaemonCalls": 0,
    "ociCalls": 0,
    "postgresProcesses": 0,
    "postgresConnections": 0,
    "databaseIdentities": 0,
    "sqlApplyRuns": 0,
    "sqlVerifyRuns": 0,
    "sqlRollbackRuns": 0,
    "domainStatementRuns": 0,
    "productNetworkEffects": 0,
    "productionDatabaseOrDataEffects": 0,
    "runtimeActivations": 0,
    "routeActivations": 0,
    "vaultEffects": 0,
    "httpsEffects": 0,
    "trafficActivations": 0,
    "realRoomProjectionCuratorGuestBytes": 0,
    "providerCalls": 0,
    "modelCalls": 0,
    "emailCalls": 0,
    "deployments": 0,
    "publications": 0,
    "admissions": 0,
    "gateCActivations": 0,
    "pushes": 0,
    "pullRequests": 0,
    "merges": 0,
    "releases": 0,
    "spendUsd": 0
  },
  "documentationScope": {
    "legacyR4DocsAuditPassed": true,
    "operationalCurrentStatusSurfacesCurrent": false,
    "wholeRepositoryDocumentationCurrentClaimed": false,
    "statusFreezeRequired": true
  },
  "artifacts": {
    "artifactIndexSha256": "sha256:0dc154f786646243a13d500b0a41ae31cbcba42b15d1ed426503bf72d6ba2b4b",